{
  "schema_version": "1.0",
  "project_id": "project.vibehub",
  "generated_at": "2026-07-11T08:00:00.000Z",
  "model_version": "model.fixture.1",
  "freshness": "fresh",
  "completeness": "partial",
  "evidence_refs": [
    {
      "evidence_id": "ev.fixture",
      "kind": "test",
      "grade": "hard_observed",
      "label_key": "evidence.fixture.generated",
      "locator": "fixtures/v3/ev.fixture",
      "captured_at": "2026-07-11T08:00:00.000Z"
    }
  ],
  "warnings": [
    {
      "code": "SUBTREE_INACCESSIBLE",
      "severity": "warning",
      "message_key": "warning.subtree_inaccessible",
      "evidence_refs": [
        {
          "evidence_id": "ev.fixture",
          "kind": "test",
          "grade": "hard_observed",
          "label_key": "evidence.fixture.generated",
          "locator": "fixtures/v3/ev.fixture",
          "captured_at": "2026-07-11T08:00:00.000Z"
        }
      ]
    },
    {
      "code": "ANALYZER_UNSUPPORTED",
      "severity": "warning",
      "message_key": "warning.analyzer_unsupported",
      "evidence_refs": [
        {
          "evidence_id": "ev.fixture",
          "kind": "test",
          "grade": "hard_observed",
          "label_key": "evidence.fixture.generated",
          "locator": "fixtures/v3/ev.fixture",
          "captured_at": "2026-07-11T08:00:00.000Z"
        }
      ]
    }
  ],
  "errors": [],
  "task_id": "task.m0",
  "state": "available",
  "results": [
    {
      "result_id": "result.m0.evaluation",
      "kind": "evaluation",
      "session_id": "session.main",
      "node_id": "node.contracts",
      "request": {
        "source": "evaluation_instruction",
        "instruction": "按 V3 契约验证全部 fixture 并报告不一致"
      },
      "status": "succeeded",
      "summary": "全部契约与 fixture 校验通过",
      "body": "契约、引用、生成类型和场景覆盖均通过。",
      "evaluation": {
        "target": "V3 contract corpus",
        "rubric": [
          "JSON Schema 合法",
          "Fixture 全覆盖",
          "生成类型无漂移"
        ],
        "verdict": "passed",
        "findings": [
          {
            "title": "契约一致",
            "detail": "所有场景均通过对应 schema。",
            "severity": "info",
            "evidence_refs": [
              {
                "evidence_id": "ev.validation",
                "kind": "test",
                "grade": "hard_observed",
                "label_key": "evidence.fixture.generated",
                "locator": "fixtures/v3/ev.validation",
                "captured_at": "2026-07-11T08:00:00.000Z"
              }
            ]
          }
        ]
      },
      "artifacts": [
        {
          "label": "契约检查报告",
          "path": {
            "platform": "macos",
            "native": "/Users/alex/Projects/VibeHub/contracts/v3/README.md",
            "display": "/Users/alex/Projects/VibeHub/contracts/v3/README.md",
            "identity_key": "macos:/Users/alex/Projects/VibeHub/contracts/v3/README.md",
            "path_kind": "absolute",
            "accessible": true
          },
          "uri": null
        }
      ],
      "started_at": "2026-07-11T07:58:00.000Z",
      "completed_at": "2026-07-11T08:05:00.000Z",
      "evidence_refs": [
        {
          "evidence_id": "ev.validation",
          "kind": "test",
          "grade": "hard_observed",
          "label_key": "evidence.fixture.generated",
          "locator": "fixtures/v3/ev.validation",
          "captured_at": "2026-07-11T08:00:00.000Z"
        }
      ]
    }
  ]
}
